objectid_1,name,cat1,post_id
1,Azusa Powerplant Conduit,Physical Features,24626.0
2,Motion Picture And Television Fund Hospital,Health and Mental Health,26620.0
3,Pacoima Memorial Hospital,Health and Mental Health,27055.0
4,Whiteman Airport,Transportation,13559.0
5,Kaiser Permanente - Woodland Hills Medical Center,Health and Mental Health,730.0
6,Pacifica Hospital Of The Valley,Health and Mental Health,637.0
7,Northeast Valley Health Corporation - Pacoima Health Center And Wic Site,Health and Mental Health,70599.0
